orig_toxic,orig_neutral,toxic_comment,neutral_comment,lang,sim_score,toxic_score,neutral_score
some people who claim to love wildlife are either lying about it or are just plain stupid .,Some people who claim to love wildlife are either lying about it or are just dense.,የዱር አራዊትን እንወዳለን የሚሉ ሰዎች በውሸት ይዋሻሉ ወይም ተራ ደደብ ናቸው።,አንዳንድ የዱር አራዊትን እንወዳለን የሚሉ ሰዎች ወይ ይዋሻሉ ወይም ጥቅጥቅ ያሉ ናቸው።,am,0.8300072550773621,0.9889853000640869,0.0061948299407958984
they will regard him as a childish buffoon that has to be handle carefully .,they will regard him as a childish person that needs to be handled carefully.,በጥንቃቄ መያዝ ያለበት የልጅነት ጎሽ አድርገው ይመለከቱታል .,በጥንቃቄ መያዝ ያለበት የልጅነት ሰው አድርገው ይመለከቱታል።,am,0.7442426681518555,0.0009219646453857422,0.0013315677642822266
"sorry kelly , we dont want you or your filthy coal up here in canada .","sorry kelly, we dont want you or your coal up here in canada",ይቅርታ ኬሊ፣ አንተን ወይም ቆሻሻ የድንጋይ ከሰልህን እዚህ ካናዳ ውስጥ አንፈልግም።,ይቅርታ ኬሊ፣ አንተን ወይም የድንጋይ ከሰልህን እዚህ ካናዳ ውስጥ አንፈልግም።,am,0.9333623051643372,0.9791622161865234,0.9811784625053406
as ive said before youre an idiot .,"As I already said, your opinion doesn't count.",ከዚህ በፊት እንደተናገርከው ደደብ ነህ።,አስቀድሜ እንዳልኩት አስተያየትህ ዋጋ የለውም።,am,0.7297111749649048,0.9993189573287964,0.0006621479988098145
get your lazy commie ass back here !,You Comeback here !,ሰነፍ ኮሜ አህያሽን ወደዚህ ይመልሱ!,ወደዚህ ተመለሱ!,am,0.7940710783004761,0.008351564407348633,0.0005560517311096191
will never willingly watch that crap ever again .,will never willingly watch that thing ever again,በፍቃደኝነት ያንን ጥፋት እንደገና አይመለከትም ።,ያንን ነገር በፈቃደኝነት እንደገና አይመለከትም,am,0.7942534685134888,0.0006052255630493164,0.0006588101387023926
you cant buy everything on amazon many people would be too dumb to use it .,you cant buy everything on amazon many people would be unable to use it .,በአማዞን ላይ ሁሉንም ነገር መግዛት አይችሉም ብዙ ሰዎች እሱን ለመጠቀም በጣም ደደብ ይሆናሉ።,ሁሉንም ነገር በአማዞን መግዛት አይችሉም ብዙ ሰዎች ሊጠቀሙበት አይችሉም።,am,0.9213643074035645,0.0012454986572265625,0.00035881996154785156
you cant buy everything on amazon many people would be too dumb to use it .,You can't buy everything on Amazon,በአማዞን ላይ ሁሉንም ነገር መግዛት አይችሉም ብዙ ሰዎች እሱን ለመጠቀም በጣም ደደብ ይሆናሉ።,ሁሉንም ነገር በአማዞን ላይ መግዛት አይችሉም,am,0.9213643074035645,0.0012454986572265625,0.0008085370063781738
you know damn well i didnt do jack shit .,you know very well i didnt do jack things,በደንብ ታውቃለህ እኔ ጃክ ሺት አላደረግኩም.,እኔ የጃክ ነገሮችን እንዳልሠራሁ በደንብ ታውቃለህ,am,0.8871622085571289,0.0013386011123657227,0.004721879959106445
both pence and trump are evil .,Pence and Trump are not good,ፔንስም ሆነ ትራምፕ ክፉ ናቸው .,ፔንስ እና ትራምፕ ጥሩ አይደሉም,am,0.7785459756851196,0.0018862485885620117,0.001087188720703125
the saudi royalsbe stupid but i dont believe the saudis do not have good advisers .,i dont believe the saudis do not have good advisers .,የሳውዲ ሮያል ቤተሰብ ደደብ ግን ሳውዲዎች ጥሩ አማካሪዎች እንደሌላቸው አላምንም።,ሳውዲዎች ጥሩ አማካሪዎች እንደሌላቸው አላምንም.,am,0.8568273782730103,0.9975965619087219,0.01676952838897705
"party voters like ignorant puppets , and guess what ?","party voters are less educated , and guess what ?",የፓርቲ መራጮች አላዋቂ አሻንጉሊቶች ይወዳሉ እና ምን ገምቱ?,የፓርቲ መራጮች ብዙም ያልተማሩ ናቸው እና ምን ገምቱ ?,am,0.7632402181625366,0.0012289881706237793,0.0006628632545471191
trump is a pile of garbage .,Trump is not a good man.,ትራምፕ የቆሻሻ ክምር ነው።,ትራምፕ ጥሩ ሰው አይደሉም።,am,0.874555230140686,0.9873836636543274,0.432891845703125
"hes a killer , though , mr .","hes not a good person , though , mr .",እሱ ገዳይ ነው፣ ቢሆንም፣ Mr.,"እሱ ጥሩ ሰው አይደለም, ቢሆንም, Mr.",am,0.8857989311218262,0.9260350465774536,0.0009527802467346191
youre nothing to me motherfcker .,You mean nothing to me,ለእኔ ምንም አይደለሽም motherfcker .,ለእኔ ምንም ማለትህ ነው።,am,0.9616172313690186,0.9992883801460266,0.0007752180099487305
"dear alaexis , this kid is an asshole , does not understand anything , an idiot .","Dear Alaexis, this kid does not understand anything.",ውድ አሌክሲስ ይህ ልጅ ጨካኝ ነው ምንም አይገባውም ደንቆሮ .,"ውድ አሌክሲስ, ይህ ልጅ ምንም ነገር አይረዳውም.",am,0.7741402387619019,0.006407201290130615,0.00045496225357055664
was it trumps fault that john podesta was dumb enough to bite on a fishing email ?,It wasn't trump fault that John Podesta opened fishing email,ጆን ፖዴስታ በአሳ ማጥመጃ ኢሜል ላይ ለመንከስ ዲዳ ነበር ማለት ነው?,ጆን ፖዴስታ የአሳ ማጥመጃ ኢሜል የከፈተው የትራምፕ ስህተት አልነበረም,am,0.8074550032615662,0.010231614112854004,0.008838057518005371
yah who do those filthy stinking evil rich people think they are giving away $ 2b ?,Who do those rich people think they are giving away 2billion dollars?,ያ እነዚያ ቆሻሻ የሚገማ ክፉ ባለጠጎች $2b አሳልፈው የሚሰጡ የሚመስላቸው ማን ነው?,እነዚ ሀብታሞች 2ቢሊየን ዶላር እየሰጡ ነው ብለው ያስባሉ?,am,0.8913679122924805,0.9913401007652283,0.0009844303131103516
the really dumb electorate is right here how else to explain justin trudeau as pm ?,The really unsuitable electorate is right here how else to explain Justice Trudeau as PM?,የምር ዲዳው መራጭ ልክ እዚህ አለ እንዴት ሌላ ጀስቲን ትሩዶን እንደ pm ማስረዳት ይቻላል?,በእውነት ተገቢ ያልሆነው መራጭ እዚህ ጋር ነው ፍትህ ትዕግስትን እንደ ጠ/ሚ/ር እንዴት ሌላ ማስረዳት ይቻላል?,am,0.7578628063201904,0.005091607570648193,0.0008589029312133789
"unfortunately , it will be hawaii that pays , not this fool .","unfortunately , it will be hawaii that pays , not this guy .",የሚያሳዝነው ግን የሚከፍለው ሃዋይ እንጂ ይህ ሞኝ አይደለም።,የሚያሳዝነው ይህ ሰው ሳይሆን የሚከፍለው ሃዋይ ነው ።,am,0.7707616090774536,0.0006135702133178711,0.0007233023643493652
you arent smart enough to understand humor .,You don't understand this kind of humor,ቀልድ ለመረዳት ብልህ አይደለህም።,እንደዚህ አይነት ቀልድ አይገባችሁም።,am,0.8809734582901001,0.000698089599609375,0.0007186532020568848
i find clough to often be a disrespectful jerk .,I find clough to be often be a disrespectful person.,ክሎክ ብዙውን ጊዜ አክብሮት የጎደለው ጅል ሆኖ አግኝቼዋለሁ።,ክላቹ ብዙውን ጊዜ አክብሮት የጎደለው ሰው ሆኖ አግኝቼዋለሁ።,am,0.860137939453125,0.007708251476287842,0.0004233717918395996
only to replaced by another braindead consensus .,Only to be replaced by another general agreement,በሌላ የጭንቅላት መግባባት ለመተካት ብቻ .,በሌላ አጠቃላይ ስምምነት ለመተካት ብቻ,am,0.7874819040298462,0.003925800323486328,0.0007646083831787109
"don young , liar and scammer .",Don Young is not a good person.,"ዶን ወጣት , ውሸታም እና አጭበርባሪ .",ዶን ያንግ ጥሩ ሰው አይደለም።,am,0.9197784662246704,0.9976691603660583,0.0011366605758666992
"we are not totally stupid , we know she works for cnn .","we are not totally stupid , we know she works for cnn .",እኛ ሙሉ በሙሉ ሞኞች አይደለንም ፣ እሷ ለ cnn እንደምትሰራ እናውቃለን።,እኛ ሙሉ በሙሉ ሞኞች አይደለንም ፣ እሷ ለ cnn እንደምትሰራ እናውቃለን።,am,0.9325729608535767,0.0006787776947021484,0.0006787776947021484
"just not some people , like this rich jerk .","just not some people , like this rich",ልክ እንደዚ ባለጸጋ ጅራፍ ያሉ አንዳንድ ሰዎች አይደሉም።,እንደ እነዚህ ሀብታም ያሉ አንዳንድ ሰዎች አይደሉም,am,0.8543580770492554,0.004404842853546143,0.01964801549911499
this is what happens whens fools send a boy to do a mans job .,this is what happens whens people send a boy to do a mans job .,ሞኞች ወንድ ልጅ ወደ ሰው ስራ ሲልኩ ይህ ነው የሚሆነው።,ሰዎች ወንድ ልጅ ወደ ወንድ ሥራ ሲልኩ ይህ ነው የሚሆነው።,am,0.7499558329582214,0.00208359956741333,0.0033313632011413574
the lot of them are not worthy of respect and should be driven from the communityent people .,"Lot of people do not deserve respect,they are supposed to be driven away.",ብዙዎቹ ክብር የማይገባቸው እና ከማኅበረሰቡ መባረር አለባቸው.,"ብዙ ሰዎች መከበር አይገባቸውም, መባረር አለባቸው.",am,0.7731982469558716,0.014981091022491455,0.0011664032936096191
trump is a liar and a psychotic .,Trump is indifferent and not into his senses.,ትራምፕ ውሸታም እና ስነ ልቦናዊ ነው .,ትራምፕ ግድየለሾች እንጂ ወደ ስሜቱ አይደሉም።,am,0.84389328956604,0.0025339126586914062,0.002542436122894287
the problem is that their management is so ridiculously incompetent .,the problem is that their management is so incompetent.,ችግሩ ያለው አመራራቸው በጣም አስቂኝ በሆነ መልኩ ብቃት የሌለው መሆኑ ነው።,ችግሩ ያለው አመራራቸው በጣም ብቃት የሌለው መሆኑ ነው።,am,0.8307895660400391,0.9910529255867004,0.9946324825286865
"your comment is disgusting , but more than that , its unchristian .",Your comment is not good,አስተያየትህ አስጸያፊ ነው ነገር ግን ከዚህ በላይ ግን ክርስቲያናዊ ያልሆነ ነው።,አስተያየትህ ጥሩ አይደለም።,am,0.8909313678741455,0.0006549954414367676,0.0005351901054382324
now to digest it for you the above sentence ( quoted ) is downright stupid .,now to digest it for you the above sentence ( quoted ) is downright wrong.,አሁን ከላይ ያለውን ዓረፍተ ነገር ለናንተ ማውለቅ (የተጠቀሰው) ፍጹም ደደብ ነው።,አሁን ከላይ ያለውን ዓረፍተ ነገር (የተጠቀሰው) ለእርስዎ ለመፍጨት ፍጹም ስህተት ነው።,am,0.8642255067825317,0.4532421827316284,0.0008172392845153809
now he we could only figure who those darn neonazis support .,now he we could only figure who those neonazis support.,አሁን እነዚያ ዳርን ኒዮናዚዎች የሚደግፉትን ብቻ ነው ማወቅ የምንችለው።,አሁን እነዚያ ኒዮናዚዎች የሚደግፉትን ብቻ ነው ማወቅ የምንችለው።,am,0.8455318212509155,0.9391300082206726,0.02476644515991211
call it the final stupidity .,Call it unintelligent.,የመጨረሻውን ሞኝነት ይደውሉ .,የማሰብ ችሎታ የሌለው ይደውሉ.,am,0.844063401222229,0.0012992620468139648,0.9859308004379272
"uber , pay your taxes like everybody else and shut up .","Uber, pays your taxes like everybody else.",uber እንደማንኛውም ሰው ግብርህን ክፈልና ዝም በል ።,ኡበር፣ እንደማንኛውም ሰው ግብርዎን ይከፍላል።,am,0.8654056787490845,0.0005104541778564453,0.0024772286415100098
someone should tell this jackass that loose lips sink ships .,Someone should tell him that loose lips sinks ships,አንድ ሰው ለዚህ ጃካስ የተላቀቀ ከንፈር መርከቦችን እንደሚሰምጥ መንገር አለበት .,የላላ ከንፈሮች መርከቦችን እንደሚሰምጡ አንድ ሰው ሊነግረው ይገባል,am,0.7943474054336548,0.19089984893798828,0.9242463707923889
quite frankly people like you are dinosaurs with no vision .,quite people like you have no vision.,በትክክል እንደ እርስዎ ያሉ ሰዎች ምንም ራዕይ የሌላቸው ዳይኖሰርቶች ናቸው.,እንደ እርስዎ ያሉ ብዙ ሰዎች ራዕይ የላቸውም።,am,0.8333911895751953,0.9987096786499023,0.0005745887756347656
just stop stealing our money and do you bloody job .,Stop stealing our money and do your job,ገንዘባችንን መስረቅን አቁመህ ደም አፋሳሽ ስራ ሰራህ .,ገንዘባችንን መስረቅን አቁም እና ስራችሁን ስሩ,am,0.7493878602981567,0.004709839820861816,0.0007484555244445801
this diseased sob needs to be silenced for all of eternity,this diseased sob needs to be silenced for all of eternity,ይህ የታመመ ማልቀስ ለዘላለም ጸጥ ሊደረግለት ይገባል,ይህ የታመመ ማልቀስ ለዘላለም ጸጥ ሊደረግለት ይገባል,am,0.863145112991333,0.9951618313789368,0.9951618313789368
"and youre as smart as a big mouthed , small brained , juvenile .",you are not good,እና እንደ ትልቅ አፍ ፣ ትንሽ አእምሮ ፣ ታዳጊዎች ብልህ ነዎት።,አንተ ጥሩ አይደለህም,am,0.8693653345108032,0.013885140419006348,0.0012958049774169922
"this is why i gave up teaching , because of fucking retards like you !","This is why I gave up teaching, because of people like you!",በዚህ ምክንያት ነው ማስተማሩን የተውኩት እንዳንተ ባሉ ዘማቾች ምክንያት!,እንደ አንተ ባሉ ሰዎች ምክንያት ማስተማርን የተውኩት ለዚህ ነው!,am,0.7976090312004089,0.0008834004402160645,0.001024007797241211
wtf is wrong with people ?,What's wrong with people?,wtf በሰዎች ላይ ስህተት ነው?,ሰዎች ምን ችግር አለባቸው?,am,0.9606413841247559,0.0011124014854431152,0.0004512667655944824
i didnt vote for the liar,i didnt vote for the liar,ለዋሸተኛው አልመረጥኩም,ለዋሸተኛው አልመረጥኩም,am,0.8243614435195923,0.0017427802085876465,0.0017427802085876465
the crisis of opioid deaths is a direct result of the stupid and corrupt policy of prohibition .,the crisis of opioid deaths is a direct result of thr policy of prohibition .,የኦፒዮይድ ሞት ቀውስ የሞኝ እና የተበላሸ የእገዳ ፖሊሲ ቀጥተኛ ውጤት ነው።,የኦፒዮይድ ሞት ቀውስ በቀጥታ የክልከላ ፖሊሲ ውጤት ነው።,am,0.9021884202957153,0.005063772201538086,0.0017020106315612793
"again , more silly liberal games .","again, more unsuitable liberal games.",እንደገና ፣ የበለጠ ሞኝ የሊበራል ጨዋታዎች።,"እንደገና, ይበልጥ ተገቢ ያልሆኑ የሊበራል ጨዋታዎች.",am,0.887665867805481,0.003089725971221924,0.001882314682006836
"an armed society is a sick , dangerous , often accidentally shot society me .",an armed society is a dangerous one,የታጠቀ ማህበረሰብ የታመመ ፣ አደገኛ ፣ ብዙ ጊዜ በአጋጣሚ ህብረተሰቡን በጥይት ይመታኛል።,የታጠቀ ማህበረሰብ አደገኛ ነው።,am,0.8742141723632812,0.004706442356109619,0.009235024452209473
that filthy little homewrecker has some nerve to cop such an attitude .,This unreasonable guy has some nerve to deal such a behavior .,ያ ቆሻሻ ትንሽ የቤት ሰባሪ እንዲህ ያለውን አመለካከት ለመቋቋም አንዳንድ ነርቭ አለው .,ይህ ምክንያታዊ ያልሆነ ሰው እንዲህ ያለውን ባህሪ ለመቋቋም አንዳንድ ነርቭ አለው.,am,0.8511867523193359,0.48838841915130615,0.0007604360580444336
and why the hell would anyone want to listen to this raving harpie ?,And why would anyone listen to this loud talker,እና ለምንድነው ማንም ሰው ይህን ተንኮለኛ ሃርፒ መስማት የሚፈልገው?,እና ማንም ሰው ይህን ጮክ ያለ ተናጋሪ ለምን ይሰማል?,am,0.8884865045547485,0.14784395694732666,0.0013690590858459473
we are stuck with this little bugger for almostmore years .,we are stuck with this little bugger for almost more years .,ከዚህ ትንሽ ተባይ ጋር ተጣብቀን ለተጨማሪ አመታት ቆይተናል።,ከዚህ ትንሽ ተባይ ጋር ተጣብቀን ለተጨማሪ አመታት ቆይተናል።,am,0.8298482894897461,0.004024922847747803,0.004024922847747803
good luck wid dat you quer fuking homo .,good luck with that,መልካም እድል wid dat you quer fuking homo .,መልካም እድል በዚ,am,0.9436607360839844,0.9996645450592041,0.0008667111396789551
its ignorance like yours that is a nightmare,It's ignorance like yours that is bad,እንደ አንተ ያለ ድንቁርና ቅዠት ነው።,መጥፎው እንደ አንተ ያለ ድንቁርና ነው።,am,0.6770108938217163,0.9874045848846436,0.8537102341651917
just another growing symptom of the problems yet to come wholly sanctioned by the idiotdividerinchief .,Just another symptom of the problem is yet to come by the chief,ሌላ የሚያድግ የችግሮች ምልክት ገና በጅሎች መከፋፈል ሙሉ በሙሉ ተቀባይነት ያለው ነው።,ሌላው የችግሩ ምልክት በአለቃው ሊመጣ ነው።,am,0.6696538329124451,0.015131115913391113,0.0006771087646484375
"hey , ipadperson , please try to keep fuck etc out of edit summaries .",Hey ipad person please try to keep out of edit summaries.,ሃይ፣ አይፓድ ሰው፣ እባክህ ፌክ ወዘተን ከአርትዕ ማጠቃለያዎች ለመጠበቅ ሞክር።,ሃይ አይፓድ ሰው እባክዎን ከአርትዖት ማጠቃለያዎች ለመውጣት ይሞክሩ።,am,0.8514968752861023,0.025896966457366943,0.004850327968597412
this is all so ridiculous .,This is all not making sense.,ይህ ሁሉ በጣም አስቂኝ ነው.,ይህ ሁሉ ትርጉም አይሰጥም።,am,0.8810461759567261,0.0006771087646484375,0.00039654970169067383
lets educate another idiot libtard .,Let's educate another liberal.,ሌላ ደደብ ሊታርድ እናስተምር .,ሌላ ሊበራል እናስተምር።,am,0.746623158454895,0.9981021285057068,0.0012124180793762207
hilary clinton is a horrible person .,Hilary clinton is not a good person.,ሂላሪ ክሊንተን አሰቃቂ ሰው ነው .,ሂላሪ ክሊንተን ጥሩ ሰው አይደለም.,am,0.9347862005233765,0.00273740291595459,0.0013071894645690918
"i know , im a horrible bigoted , murdering oppressor by right of birth .",I know I'm little bad person from birth,ጨቋኝን በመወለድ የሚገድል ዘግናኝ ጨካኝ እንደሆንኩ አውቃለሁ።,ከተወለድኩበት ጊዜ ጀምሮ ትንሽ መጥፎ ሰው እንደሆንኩ አውቃለሁ,am,0.8012598156929016,0.0156518816947937,0.0009741783142089844
he is corrupt which is unusual for a democrat .,he is not honest which is unusual for a democrat,ለዴሞክራት ያልተለመደ ሙሰኛ ነው።,እሱ ሐቀኛ አይደለም ይህም ለዴሞክራት ያልተለመደ ነው።,am,0.6989967823028564,0.0013170838356018066,0.00038421154022216797
oh ok fuck you asshole die im going to kill you,you are to bad to live,ኧረ እሺ ባክህ አሽሙር ሙት ልገድልህ ነው።,ለመኖር መጥፎ ነው,am,0.8216320276260376,0.9954932928085327,0.005660116672515869
absolutely the most fucking horrible film ever .,absolutely worst film ever .,ፍፁም በጣም አስፈሪው አስፈሪ ፊልም .,ፍፁም የከፋ ፊልም .,am,0.8562924265861511,0.00034248828887939453,0.0007020235061645508
after seeing shit like this i expected you to be some throwaway sock puppet .,after seeing this i expected you not to be as good as you are,እንደዚህ አይነት ቆሻሻ ካየሁ በኋላ የምትጥለው የሶክ አሻንጉሊት እንድትሆኑ ጠብቄ ነበር።,ይህን ካየሁ በኋላ እንደ እርስዎ ጥሩ እንዳልሆኑ ጠብቄ ነበር,am,0.8335534930229187,0.009403467178344727,0.0007169842720031738
the garbage that is being created by cnn and other news agencies is outrageous .,the garbage that is being created by cnn and other news agencies is outrageous .,በሲኤንኤን እና በሌሎች የዜና ኤጀንሲዎች እየተፈጠረ ያለው ቆሻሻ በጣም አስጸያፊ ነው።,በሲኤንኤን እና በሌሎች የዜና ኤጀንሲዎች እየተፈጠረ ያለው ቆሻሻ በጣም አስጸያፊ ነው።,am,0.8394393920898438,0.0009327530860900879,0.0009327530860900879
fired over a stupid joke .,Fired over a joke,በሞኝ ቀልድ ተኮሰ .,በቀልድ ተኮሰ,am,0.7249718308448792,0.005126297473907471,0.0028550028800964355
and his parents are worse .,and his parents are not good.,እና ወላጆቹ የከፋ ናቸው.,እና ወላጆቹ ጥሩ አይደሉም.,am,0.8840091228485107,0.004836678504943848,0.0022085905075073242
"100,000 people paid money to watch this garbage .","100,000 people paid money to watch this nonsense","ይህን ቆሻሻ ለማየት 100,000 ሰዎች ገንዘብ ከፍለዋል።","ይህን ከንቱ ነገር ለማየት 100,000 ሰዎች ገንዘብ ከፍለዋል።",am,0.9198060631752014,0.332868754863739,0.9911383986473083
it is easy to spot those racist idiots .,it is easy to spot those racist.,እነዚያን ዘረኛ ደደቦች መለየት ቀላል ነው።,እነዚያን ዘረኞች መለየት ቀላል ነው።,am,0.8320155143737793,0.9992088675498962,0.0007349848747253418
gerald you need to stop recycling the same silly post over and over again .,"Gerald, please stop recycling the same post over and over again.",ጄራልድ ተመሳሳዩን የሞኝ ፖስት ደጋግሞ መጠቀም ማቆም አለቦት።,ጄራልድ፣ እባክህ ተመሳሳዩን ልጥፍ ደጋግሞ መጠቀም አቁም።,am,0.7485051155090332,0.006139278411865234,0.0005780458450317383
we face a tidal wave of aggressive and impatient and ignorant drivers .,we face a tidal wave of aggressive and impatient and ignorant drivers .,የኃይለኛ እና ትዕግስት የሌላቸው እና የማያውቁ አሽከርካሪዎች ማዕበል ገጥሞናል።,የኃይለኛ እና ትዕግስት የሌላቸው እና የማያውቁ አሽከርካሪዎች ማዕበል ገጥሞናል።,am,0.8063033819198608,0.00512617826461792,0.00512617826461792
"who cares loser lib troll , they are all so pathetic and incompetent and corrupt they should resign period","Who cares, they are incapable and not suitable, they should resign period.",ማን ይንከባከባል ተሸናፊ ሊብ ትሮል ፣ ሁሉም በጣም አዛኝ እና ብቃት የሌላቸው እና ሙሰኞች በመሆናቸው የስራ ጊዜ መልቀቅ አለባቸው,"ማን ያስባል, አቅም የሌላቸው እና ተስማሚ አይደሉም, ጊዜያቸውን መልቀቅ አለባቸው.",am,0.8186357021331787,0.9973053932189941,0.004956245422363281
he appears to thrive on this stuff and often makes the media look like fools .,He appears to thrive on his stuff and often makes the media less valuable.,በዚህ ነገር የበለፀገ ይመስላል እና ብዙ ጊዜ ሚዲያዎችን ሞኞች ያስመስላል።,እሱ በእቃዎቹ ላይ የበለፀገ ይመስላል እና ብዙውን ጊዜ ሚዲያውን ዋጋ ዝቅ ያደርገዋል።,am,0.8569936752319336,0.000529944896697998,0.0008525848388671875
they do the same with the clown .,they do likewise with the jokester .,እነሱም እንዲሁ ያደርጋሉ ክሎውን .,ከቀልደኛው ጋርም እንዲሁ ያደርጋሉ።,am,0.7853156328201294,0.0004954338073730469,0.0008136630058288574
"yo ed , you are an infidel .","yo ed , you are unbeliever",yo ed አንተ ካፊር ነህ ።,አንተ የማታምን ነህ,am,0.762014627456665,0.9989755153656006,0.9592567086219788
every vote for trump enabled a pervert .,every vote for trump enabled not a good man.,ለትራምፕ እያንዳንዱ ድምጽ ጠማማ አስችሏል።,እያንዳንዱ የትራምፕ ድምጽ ጥሩ ሰው አልነበረም።,am,0.7874318957328796,0.0012168288230895996,0.0014231204986572266
