orig_toxic,orig_neutral,toxic_comment,neutral_comment,lang,sim_score,toxic_score,neutral_score
i didnt vote for her because she is pure evil .,I didnt vote for her because I don't like her.,ንፁህ ክፉ ስለሆነች አልመረጥኳትም።,ስለማልወዳት አልመረጥኳትም።,am,0.8174822330474854,0.0009441971778869629,0.00043827295303344727
there is no evidence that he was a muslim it sounds more like he was schizophrenic .,There is no evidence that he was a muslim.,እሱ ሙስሊም ስለመሆኑ ምንም ማስረጃ የለም ፣ እሱ ስኪዞፈሪኒክ እንደነበረው ይመስላል።,ሙስሊም ለመሆኑ ምንም ማስረጃ የለም።,am,0.8905309438705444,0.0022925138473510742,0.0031424760818481445
transgender women are not going to hurt you or your children .,transgender women are not going to hurt you or your children .,ትራንስጀንደር ሴቶች እርስዎን ወይም ልጆችዎን አይጎዱም.,ትራንስጀንደር ሴቶች እርስዎን ወይም ልጆችዎን አይጎዱም.,am,0.8960133790969849,0.026409029960632324,0.026409029960632324
allie is the most ignorant fake news spewer on this board !,Do not trust allie news.,አሊ በዚህ ሰሌዳ ላይ በጣም አላዋቂው የውሸት ዜና ተናጋሪ ነው!,በአሊ ዜና አትመኑ።,am,0.8978075981140137,0.323256254196167,0.11828827857971191
she is such a lying scum bag .,She lies,እሷ እንደዚህ አይነት የውሸት ቆሻሻ ቦርሳ ነች .,ትዋሻለች።,am,0.8798472285270691,0.9983543157577515,0.004153072834014893
these people are nothing but wastes .,These people are not useful.,እነዚህ ሰዎች ቆሻሻ እንጂ ሌላ አይደሉም።,እነዚህ ሰዎች ጠቃሚ አይደሉም.,am,0.8626928925514221,0.9973528385162354,0.006540417671203613
"after people pay xcels guaranteed profit margin , whats a few bucks for some stupid commericals ?","after people pay xcels guaranteed profit margin , whats a few bucks for some commericals ?",ሰዎች xcels የተረጋገጠ የትርፍ ህዳግ ከከፈሉ በኋላ ለአንዳንድ ደደብ ነጋዴዎች ጥቂት ዶላሮች ምንድናቸው?,ሰዎች በ xcels የተረጋገጠ የትርፍ ህዳግ ከከፈሉ በኋላ፣ ለአንዳንድ ኮሜርጀሮች ጥቂት ዶላሮች ምንድናቸው?,am,0.8684680461883545,0.971558153629303,0.002253711223602295
"pick up a history book sometime , and read the damn thing .","Pick up a history book sometime, and read more.",የሆነ ጊዜ የታሪክ መጽሐፍ አንስተህ አንብብ።,የሆነ ጊዜ የታሪክ መጽሐፍ አንሳ እና የበለጠ አንብብ።,am,0.8381913900375366,0.0008791089057922363,0.0007845163345336914
because they knew how dangerous and stupid it was to carry a gun around in public .,Because they knew how dangerous it was to carry a gun around in public,ምክንያቱም በአደባባይ ሽጉጥ መያዝ ምን ያህል አደገኛ እና ደደብ እንደሆነ ስለሚያውቁ .,ምክንያቱም ሽጉጡን በአደባባይ መዞር ምን ያህል አደገኛ እንደሆነ ያውቁ ነበር።,am,0.8601664304733276,0.004346013069152832,0.0005869865417480469
they are practically twins and equally dullwitted .,They’re practically twins and are equally not wise,እነሱ በተግባራዊ መልኩ መንትዮች ናቸው እና በተመሳሳይ መልኩ ደብዛዛ ናቸው .,እነሱ በተግባራዊ መልኩ መንትዮች ናቸው እና በተመሳሳይ መልኩ ጥበበኛ አይደሉም,am,0.8145446181297302,0.001702725887298584,0.0060381293296813965
think what you want but the fact is that hes a nut case .,think what you want but the fact is that he's not well informed,የፈለከውን አስብ ግን እውነታው እሱ የለውዝ መያዣ ነው።,የፈለከውን አስብ ግን እውነታው እሱ በደንብ ያልተረዳ መሆኑ ነው።,am,0.8721622824668884,0.0008903145790100098,0.000743567943572998
"daily maverick , why do you publish this rubbish ?","Daily maverick, why do you publish such news?",ዕለታዊ ማቭሪክ ለምንድነው ይህን ቆሻሻ የምታትመው?,ዕለታዊ ማቬሪክ፣ ለምን እንደዚህ አይነት ዜና ታተምታለህ?,am,0.7642056345939636,0.18106776475906372,0.007399797439575195
president trump should be applauded for refusing to sign this ridiculous statement .,President trump should be applauded for refusing to sign this statement,ፕሬዚዳንት ትራምፕ ይህን አስቂኝ መግለጫ ለመፈረም ፈቃደኛ ባለመሆናቸው ሊመሰገኑ ይገባል.,ፕሬዝዳንት ትራምፕ ይህንን መግለጫ ለመፈረም ፈቃደኛ ባለመሆናቸው ሊመሰገኑ ይገባል።,am,0.8754534721374512,0.00044101476669311523,0.00040143728256225586
but we can call an idiot an idiot .,But we can call a person what he really is.,ደደብ ደደብ ልንለው እንችላለን።,ነገር ግን ሰውን በእውነት ማን እንደሆነ ልንለው እንችላለን።,am,0.6566821336746216,0.9986384510993958,0.0006192922592163086
"youre asking to be reprimanded , dumbass .",You're asking to be reprimanded.,ተግሣጽ እየጠየቅክ ዲምባስ .,ተግሣጽ እየጠየቅክ ነው።,am,0.568789005279541,0.0008020997047424316,0.000729978084564209
and some jackass over a ways is burning tires .,And someone is burning tires.,እና በመንገድ ላይ አንዳንድ ጃካዎች ጎማዎችን እያቃጠሉ ነው።,እና አንድ ሰው ጎማ እያቃጠለ ነው.,am,0.8485208749771118,0.9879531264305115,0.0020464658737182617
"i guess these guys are idiots , too , huh ?","I guess these guys are not qualified too , huh?",እኔ እገምታለሁ እነዚህ ሰዎችም ደደቦች ናቸው ?,እነዚህ ሰዎችም ብቁ አይደሉም ብዬ እገምታለሁ ፣ አዎ?,am,0.8373250961303711,0.9992908239364624,0.000535428524017334
"ridiculous , yet another attempt to maintain control over people , even after death .",Another attempt to maintain control over people even after death.,በጣም አስቂኝ፣ ከሞት በኋላም በሰዎች ላይ ቁጥጥር ለማድረግ የተደረገ ሌላ ሙከራ።,ሌላው ከሞት በኋላም ሰዎችን ለመቆጣጠር የሚደረግ ሙከራ።,am,0.8515920639038086,0.002144038677215576,0.0022096633911132812
"paprocki is denying people in same sex marriage funeral rites , not gay people .","Paprocki is denying homosexual marriage funeral rites , not homosexual people.",ፓፕሮኪ በተመሳሳዩ ፆታ ጋብቻ የቀብር ሥነ ሥርዓቶችን እንጂ ግብረ ሰዶማውያንን መካድ አይደለም።,ፓፕሮኪ የግብረ ሰዶማውያን ጋብቻ የቀብር ሥነ ሥርዓቶችን እንጂ ግብረ ሰዶማውያንን አይክድም።,am,0.8144268989562988,0.0024985671043395996,0.0046425461769104
you guys are fuckin idiots .,You guys aren't making any sense to me.,እናተ ደንቆሮዎች ናችሁ።,እናንተ ሰዎች ለእኔ ምንም ትርጉም አይሰጡኝም።,am,0.6466328501701355,0.9995379447937012,0.0014142990112304688
dumbest damn idea i ever heard .,Most worst idea.,መቼም ሰምቼው የማላውቀው ደደብ ሀሳብ።,በጣም መጥፎ ሀሳብ።,am,0.8258802890777588,0.9958742260932922,0.0017328262329101562
fuck off you little prick .,back off,ትንሽ ወጋህ .,ወደኋላ መመለስ,am,0.6626008152961731,0.0026637911796569824,0.00048804283142089844
and now wesuffer since trump is a dotard with delusions that he is some kind of diety .,and now we suffer since trump is with some kind of diety,እና አሁን ተቸገረ ምክንያቱም ትራምፕ እሱ አንድ ዓይነት አመጋገብ ነው ብሎ የማሳሳት ችሎታ ያለው ዶታርድ ነው።,እና አሁን ትራምፕ ከአንዳንድ የአመጋገብ ዓይነቶች ጋር ስለሆነ እንሰቃያለን።,am,0.7715160846710205,0.0032334327697753906,0.0008620023727416992
only in ignorant minds are assault weapons considered repulsive .,only people who didn't think things through are put off by the idea of assault weapons,በድንቁርና አእምሮ ውስጥ ብቻ የጥቃት መሣሪያዎች እንደ አስጸያፊ ተደርገው ይወሰዳሉ።,ነገሮችን ያላሰቡ ሰዎች ብቻ በአጥቂ መሳሪያዎች ሀሳብ የተወገዱ ናቸው።,am,0.8025237917900085,0.0011031627655029297,0.00041240453720092773
islamophobia what a garbage term .,islamophobia is a rude term,islamophobia ምን አይነት የቆሻሻ ቃል ነው .,ኢስላሞፎቢያ ጸያፍ ቃል ነው።,am,0.8696721792221069,0.9045723676681519,0.0006420016288757324
what the fuck is your problem ?,what is your problem?,ምኑ ላይ ነው ችግርህ?,ችግርህ ምንድን ነው?,am,0.8886638879776001,0.0006985664367675781,0.0005953311920166016
this is pathetic that shes forced to handle donalds problems .,this is sad that shes forced to handle donalds problems .,ይህ የዶናልድ ችግሮችን ለመፍታት መገደዷ አሳዛኝ ነው.,የዶናልድ ችግሮችን ለመፍታት መገደዷ ያሳዝናል ።,am,0.854860782623291,0.00347214937210083,0.0017323493957519531
"wwow wake up idiot , we already have a grid that goes from coast to coast connecting provinces !","wwow wake up, we already have a grid that goes from coast to coast connecting provinces !",ዋው ዋው ደነዝ ተነሳ፣ ከዳር እስከ ዳር የሚገናኝ ክፍለ ሀገር የሚያገናኝ ፍርግርግ አለን!,ዋው ንቃ፣ አውራጃዎችን የሚያገናኝ ከባህር ዳርቻ ወደ ባህር ዳርቻ የሚሄድ ፍርግርግ አለን!,am,0.7624173164367676,0.011026263236999512,0.00942617654800415
president trump should be applauded for refusing to sign this ridiculous statement .,President trump should be appreciated not to sign such bad statement.,ፕሬዚዳንት ትራምፕ ይህን አስቂኝ መግለጫ ለመፈረም ፈቃደኛ ባለመሆናቸው ሊመሰገኑ ይገባል.,ፕሬዝደንት ትራምፕ እንደዚህ አይነት መጥፎ መግለጫ ላለመፈረም አድናቆት ሊቸራቸው ይገባል።,am,0.8754534721374512,0.00044101476669311523,0.0029106736183166504
you clowns really need some lessons in reading comprehension along with logic and reason .,You guys really need some lessons in reading comprehension along with logic and reason,እርስዎ ክሎውንቶች ከሎጂክ እና ከምክንያት ጋር በማንበብ ግንዛቤ ውስጥ አንዳንድ ትምህርቶችን ይፈልጋሉ።,እናንተ ሰዎች ከሎጂክ እና ከምክንያት ጋር በማንበብ ግንዛቤ ውስጥ አንዳንድ ትምህርቶችን ይፈልጋሉ,am,0.8337351083755493,0.00042003393173217773,0.000390470027923584
"that being said , i think this is a stupid id .",That being said I think this is not suitable id,ይህ ሲባል ግን ይህ ደደብ መታወቂያ ይመስለኛል።,ይህ ሲነገር ይህ መታወቂያ ተስማሚ አይደለም ብዬ አስባለሁ።,am,0.8437777757644653,0.9991797804832458,0.0003921389579772949
you dont get it : clowns like jacobson believe citizen and white are synonyms .,You don't get it: people like jacobson beleive citizen and white are synonyms,አልገባህም እንደ ጃኮብሰን ያሉ ቀልዶች ዜጋ እና ነጩ ተመሳሳይ ቃላት ናቸው ብለው ያምናሉ።,አልገባህም፡ እንደ ጃኮብሰን አማናዊ ዜጋ እና ነጭ ያሉ ሰዎች ተመሳሳይ ቃላት ናቸው።,am,0.8473800420761108,0.0032716989517211914,0.0010548233985900879
yet its the liberals taking away freedoms loser,Yet its the liberals taking away freedoms.,ገና የነፃነት ተሸናፊዎች ነፃ አውጪዎች ናቸው።,ሆኖም ነፃነቶችን የሚወስዱ ሊበራሎች ናቸው።,am,0.6667150259017944,0.001766204833984375,0.9848485589027405
"haha , well just wait till im unblocked , cause once i am this useless shit is going off .",Wait until I’m unblocked so I can delete this.,ሃሃ ፣ እስኪያግድ ድረስ ጠብቅ ፣ ምክንያቱ አንዴ እኔ ከሆንኩ ይህ የማይጠቅም ቆሻሻ እየጠፋ ነው።,ይህን መሰረዝ እንድችል እገዳ እስካልነሳ ድረስ ጠብቅ።,am,0.8467260003089905,0.4013385772705078,0.0007839202880859375
unreal the imbeciles are more concerned about the wall that mexico is supposed to pay for than health care .,Some people are more concerned about the wall that mexico is supposed to pay for than health care.,ከጤና አጠባበቅ ይልቅ ሜክሲኮ መክፈል ስላለበት ግድግዳ በጣም ያሳስባቸዋል።,አንዳንድ ሰዎች ከጤና አጠባበቅ ይልቅ ሜክሲኮ መክፈል ስላለበት ግድግዳ የበለጠ ያሳስባቸዋል።,am,0.8162721395492554,0.0015392303466796875,0.000838160514831543
what the fuck is your problem ?,what is your problem,ምኑ ላይ ነው ችግርህ?,ችግርህ ምንድን ነው,am,0.8886638879776001,0.0006985664367675781,0.0007415413856506348
"stop being an ignorant deluded too , gary .","stop being ignorant too, gary.",ጋሪም አላዋቂ መሆንህን አቁም ።,ጋሪም አላዋቂ መሆንህን አቁም,am,0.7472525835037231,0.02625453472137451,0.891377866268158
paul scott isnt an idiot .,Paul Scott is smart,ፖል ስኮት ደደብ አይደለም .,ፖል ስኮት ብልህ ነው።,am,0.9162003993988037,0.0013279914855957031,0.0030213594436645508
so basically people quit a shitty minimum wage job because the boss is an asshole .,so basically people quit low minimum wage job because boss is not nice,ስለዚህ በመሠረቱ ሰዎች ትንሽ የደመወዝ ክፍያ ሥራን ያቆማሉ ምክንያቱም አለቃው አጭበርባሪ ነው .,ስለዚህ በመሠረቱ ሰዎች ዝቅተኛ የደመወዝ ክፍያ ሥራ ያቆማሉ ምክንያቱም አለቃ ጥሩ አይደለም,am,0.8574008941650391,0.0018746256828308105,0.0016312003135681152
and we elected these clowns .,And we made a mistake electing them.,እና እነዚህን አሻንጉሊቶች መረጥን.,እና እነሱን በመምረጥ ተሳስተናል።,am,0.7879883050918579,0.0014472603797912598,0.0011594891548156738
saunders classic : start with a freakin ridiculous premise and keep digging .,saunders classic: start with a ridiculous premise and keep digging,saunders ክላሲክ፡ በፍሬኪን አስቂኝ መነሻ ይጀምሩ እና መቆፈርዎን ይቀጥሉ።,saunders ክላሲክ፡ በአስቂኝ መነሻ ይጀምሩ እና መቆፈርዎን ይቀጥሉ,am,0.8171029090881348,0.0018624067306518555,0.0029665231704711914
the trump supporters are too stupid to understand this .,Trump supporters cannot understand this,የትራምፕ ደጋፊዎች ይህንን ለመረዳት በጣም ደደብ ናቸው ።,የትራምፕ ደጋፊዎች ይህንን ሊረዱ አይችሉም,am,0.8784971237182617,0.0019678473472595215,0.0006852149963378906
this is a really stupid bill .,this is a really bad bill .,ይህ በእውነት ደደብ ሂሳብ ነው .,ይህ በጣም መጥፎ ሂሳብ ነው.,am,0.8493258357048035,0.7616888880729675,0.0015056133270263672
well said and damn right !,Well said and you are right!,በደንብ ተናግሯል እና ትክክል!,ደህና ተናገርክ እና ልክ ነህ!,am,0.8915213346481323,0.0004089474678039551,0.0002967715263366699
the guy is an idiot and why on earth would google want someone that stupid working for them .,why does google want someone unprofessional working for them,ሰውዬው ደደብ ነው እና ለምን በምድር ላይ google እንዲሰራላቸው ሞኝ ሰው ይፈልጋል።,ጉግል ለምን ሞያዊ ያልሆነ ሰው እንዲሰራላቸው ይፈልጋል,am,0.9025634527206421,0.9926195740699768,0.0028731226921081543
he doesnt even understand or recognize his own nonsense .,he does not even recognize his own words,የራሱን የማይረባ ነገር እንኳን አይረዳውም ወይም አይገነዘብም .,የራሱን ቃላት እንኳ አያውቅም,am,0.8540202975273132,0.000911712646484375,0.0009157657623291016
lots of hypocrites complaining about trump but not saying anything about the krook,A lot of people complaining about Trump but not saying anything about Biden,ብዙ ግብዞች ስለ ትራምፕ እያጉረመረሙ ስለ ክሩክ ግን ምንም አይናገሩም።,ብዙ ሰዎች ስለ ትራምፕ ቅሬታ ያቀርባሉ ነገር ግን ስለ Biden ምንም አይናገሩም።,am,0.7737985253334045,0.0018877983093261719,0.0005331635475158691
what a load of conservative trash talk relying on scare tactics,Why are they relying on these tactics,በአስፈሪ ስልቶች ላይ የተመሰረተ ወግ አጥባቂ የቆሻሻ ንግግር ምን ያህል ሸክም ነው።,ለምን በእነዚህ ስልቶች ላይ ይደገፋሉ,am,0.7055577039718628,0.0031440258026123047,0.0007973313331604004
only faggots and dumb housewives use macs .,I dont like people who use macs,ደደብ እና ዲዳ የቤት እመቤቶች ብቻ ማክስ ይጠቀማሉ .,ማክስ የሚጠቀሙ ሰዎችን አልወድም።,am,0.8671774864196777,0.9982947707176208,0.0032112598419189453
"locals fight like men , mainlanders pull knives and guns , such cowards .","locals fight with honour, mainlanders pull knives and guns.",የአካባቢው ተወላጆች እንደ ወንድ ይዋጋሉ፣ የሜይንላንድ ተወላጆች ቢላዋ እና ሽጉጥ ይጎትታሉ፣ እንደዚህ አይነት ፈሪዎች።,የአካባቢው ተወላጆች በክብር ይዋጋሉ፣ የሜይንላንድ ነዋሪዎች ቢላዋ እና ሽጉጥ ይሳባሉ።,am,0.8625088930130005,0.916851282119751,0.002129077911376953
who the fck put you in charge .,Who appointed you?,ማን ነው የሾመህ።,ማን ሾመህ?,am,0.5948711037635803,0.0018570423126220703,0.0012632012367248535
cant believe youd publish this kind of drivel .,Can't believe you would publish this news.,እንደዚህ አይነት ድራይቭል እንዳትሙ ማመን አይቻልም።,ይህን ዜና እንደምታተም ማመን አልቻልኩም።,am,0.7484637498855591,0.0010532736778259277,0.0004087090492248535
"basically , you are a hypocrite .","Basically, you don't practice what you preach.",በመሠረቱ አንተ ግብዝ ነህ።,በመሰረቱ የምትሰብከውን አትለማመድም።,am,0.8457835912704468,0.9991434812545776,0.0006132125854492188
you are blowing things out of proportion because you obviously have nothing else to do than be a bully .,you are blowing things out of proportion because you obviously have nothing else to do than be a bully,ነገሮችን እየነፈሳችሁ ነው ምክንያቱም ጉልበተኛ ከመሆን ሌላ ምንም የምታደርጉት ነገር እንደሌለ ግልጽ ነው።,ነገሮችን እየነፈሱ ነው ምክንያቱም ጉልበተኛ ከመሆን ውጭ ሌላ ምንም ነገር ስለሌለዎት ግልጽ ነው።,am,0.8717132806777954,0.002367377281188965,0.0009081363677978516
ill continue to comment on your pointless posts .,I'll continue to comment on your posts .,ህመሞች በከንቱ ጽሑፎቻችሁ ላይ አስተያየት መስጠታችሁን ቀጥሉ።,በልጥፎችህ ላይ አስተያየት መስጠቴን እቀጥላለሁ።,am,0.8254299163818359,0.005059242248535156,0.00024837255477905273
the huskies will no longer be top dog but just your average bitch .,The Huskies will no longer be top dog,huskies ከአሁን በኋላ ዋና ውሻ አይሆንም ነገር ግን የእርስዎ አማካኝ ሴት ዉሻ ብቻ .,Huskies ከአሁን በኋላ ምርጥ ውሻ አይሆንም,am,0.8818281888961792,0.9772196412086487,0.9433498978614807
i am in the hands of fools in this place .,i am in the hands of unsuitable people in this place .,እኔ በዚህ ቦታ በሰነፎች እጅ ነኝ ።,እኔ እዚህ ቦታ ላይ ተገቢ ባልሆኑ ሰዎች እጅ ውስጥ ነኝ።,am,0.882526159286499,0.0005165338516235352,0.0013660788536071777
yet its the liberals taking away freedoms loser,yet its the liberals taking away freedoms,ገና የነፃነት ተሸናፊዎች ነፃ አውጪዎች ናቸው።,ግን ነፃነቶችን የሚወስዱ ሊበራሎች ናቸው።,am,0.6667150855064392,0.001766204833984375,0.9492865800857544
"well , they are sore losers , no question about it .",They are not the winners,ደህና ፣ እነሱ በጣም ተሸናፊዎች ናቸው ፣ ምንም ጥርጥር የለውም ።,አሸናፊዎቹ አይደሉም,am,0.7574474811553955,0.0003695487976074219,0.001106560230255127
trumpstweets should be hysterical since the narcissistic buffoon has no sense of humor .,Trump's tweets should be hysterical since he has no sense of humor,ናርሲሲስቲክ ቡፍፎን ምንም አይነት ቀልድ ስለሌለው ትራምፕትዊት ጅብ መሆን አለበት።,ቀልድ ስለሌለው የትራምፕ ትዊቶች ጅብ መሆን አለባቸው,am,0.8115250468254089,0.0045874714851379395,0.0013939738273620605
"grow a brain , each of you .","Each of you, please think sensibly",እያንዳንዳችሁ አእምሮን ያሳድጉ ።,እያንዳንዳችሁ እባኮትን በማስተዋል አስቡ,am,0.7686107158660889,0.9942458271980286,0.9678174257278442
"then dont waste the courts time , execute this low life piece of trash .","then dont waste the courts time, finish it now",ከዚያ የፍርድ ቤቱን ጊዜ አታባክኑ፣ ይህን ዝቅተኛ ህይወት ያለው ቆሻሻ ስራ ያከናውኑ።,ከዚያ የፍርድ ቤቱን ጊዜ አታባክኑ ፣ አሁን ይጨርሱት።,am,0.8846797943115234,0.9958723187446594,0.003907144069671631
"geez kiszla , youre about as tone deaf as the broncos .",I guess you couldn't hear me right.,ግዕዝ ኪስላ፣ እንደ ብሮንኮስ ድምፅ መስማት የተሳነህ ነህ።,በትክክል ልትሰሙኝ እንዳልቻላችሁ እገምታለሁ።,am,0.7905656099319458,0.9939073920249939,0.0005910396575927734
this is a really stupid bill .,This is an unbelievable bill.,ይህ በእውነት ደደብ ሂሳብ ነው .,ይህ የማይታመን ሂሳብ ነው።,am,0.8493258357048035,0.7616888880729675,0.0007221102714538574
trump never mentions that as he lies to his ignorant voters .,trump never mentions that as he lies to his ignorant voters .,ትራምፕ አላዋቂዎቹን መራጮች ሲዋሹ ያንን አይጠቅስም ።,ትራምፕ አላዋቂዎቹን መራጮች ሲዋሹ ያንን አይጠቅስም ።,am,0.7439039945602417,0.005629003047943115,0.005629003047943115
read the sign : report these losers .,Read the sign : report them .,ምልክቱን አንብብ፡ እነዚህን ተሸናፊዎች ሪፖርት አድርግ።,ምልክቱን አንብብ፡ ሪፖርት አድርግላቸው።,am,0.8810054063796997,0.0006641745567321777,0.0005230307579040527
"migawd , the hypocrisy of liberals knows no bounds .",the hypocrisy of liberals knows no bound.,migawd የሊበራሊቶች ግብዝነት ወሰን የለውም።,የሊበራሊቶች ግብዝነት ወሰን የለውም።,am,0.7876189947128296,0.8364932537078857,0.09384095668792725
but being a racist cunt is still all good .,To be racist might still be a good thing,ግን ዘረኛ ቂል መሆን አሁንም ጥሩ ነው።,ዘረኛ መሆን አሁንም ጥሩ ነገር ሊሆን ይችላል።,am,0.8285094499588013,0.9813812971115112,0.00037086009979248047
"they are a disgrace to canada , so .",they are a shame to canada so,ለካናዳ ውርደት ናቸው፣ ስለዚህ .,ለካናዳ አሳፋሪ ናቸው።,am,0.9160523414611816,0.9924517273902893,0.9679158329963684
i like petas mission but they are ignorant when it comes to the iditarod and .,i like petas mission but they are ignorant when it comes to the iditarod and .,ፔታስ ሚሽን እወዳለሁ ግን ወደ ኢዲታሮድ እና ሲመጣ አላዋቂዎች ናቸው።,ፔታስ ሚሽን እወዳለሁ ግን ወደ ኢዲታሮድ እና ሲመጣ አላዋቂዎች ናቸው።,am,0.7707609534263611,0.9791658520698547,0.9791658520698547
trump is the most worthless piece of nothing to come along in my lifetime .,trump is the person I feel least appreciative of knowing.,ትራምፕ በሕይወቴ ውስጥ ሊመጣ የማይችል እጅግ በጣም ዋጋ የሌለው ቁራጭ ነው።,ትራምፕ ስለማውቀው ትንሽ የማደንቀው ሰው ነው።,am,0.8738927841186523,0.004816830158233643,0.0011388063430786133
a sociopathic idiot is trying to reassure us .,An unsound someone is trying to reassure us.,አንድ የሶሲዮፓቲክ ደደብ እኛን ሊያረጋጋን እየሞከረ ነው .,ጤናማ ያልሆነ ሰው ሊያረጋጋን እየሞከረ ነው።,am,0.851823091506958,0.9983320832252502,0.0009494423866271973
